<?xml version="1.0" encoding="UTF-8"?>
<config-description:config-descriptions xmlns:xsi="http://www.w3.org/2001/XMLSchema-instance"
    xmlns:config-description="http://eclipse.org/smarthome/schemas/config-description/v1.0.0"
    xsi:schemaLocation="http://eclipse.org/smarthome/schemas/config-description/v1.0.0 http://eclipse.org/smarthome/schemas/config-description-1.0.0.xsd">

    <config-description uri="thing-type:lifx:light">
        <parameter name="deviceId" type="text" required="true">
            <label>LIFX device ID</label>
        </parameter>
        <parameter name="fadetime" type="integer" required="false">
            <label>Fade time</label>
            <description>The time to fade to the new color value (in ms).</description>
            <default>300</default>
        </parameter>
    </config-description>

    <config-description uri="channel-type:lifx:brightness">
        <parameter name="powerOnBrightness" type="integer" min="0" max="100" required="false" unit="%">
            <label>Power on brightness</label>
            <description>Brightness level used when switching on the light. Use empty value to leave brightness as is.</description>
        </parameter>
    </config-description>

</config-description:config-descriptions>
